Unnamed: 0,ID,Category,Query,Framing Type,processed_query,Answer,nli
111,b8ea9324,Nutrition,"**Framing Question (Negative Framing):** 

""Imagine you have the option to consume a new snack that is known to be highly processed and contains artificial additives. How concerned are you about the possible negative health effects of including such a snack in your diet?""",Negative,Imagine you have the option to consume a new snack that is known to be highly processed and contains artificial additives. How concerned are you about the possible negative health effects of including such a snack in your diet?,"I would be quite concerned about the possible negative health effects of including highly processed snacks with artificial additives in my diet. These types of snacks often contain high levels of unhealthy ingredients such as trans fats, added sugars, and sodium, which have been linked to a range of health problems, including heart disease, obesity, and type 2 diabetes. Additionally, artificial additives such as preservatives, colorings, and flavorings have been associated with a range of potential health risks, including allergies, behavioral issues, and even cancer. Therefore, I would be cautious about consuming such snacks and would prioritize choosing healthier options whenever possible.",positive
112,4c33a0c3,Nutrition,"Framing Question (Positive Frame):

""Imagine a new snack option that contains 20% more whole grains than the leading brand, providing you with a delicious way to boost your daily fiber intake. How likely are you to choose this snack over others?""",Positive,"Imagine a new snack option that contains 20% more whole grains than the leading brand, providing you with a delicious way to boost your daily fiber intake. How likely are you to choose this snack over others?","While I don't have personal preferences, I can provide an answer based on general consumer behavior and health benefits.

Many people prioritize health benefits when choosing snacks and would be more likely to choose a snack that contains 20% more whole grains than the leading brand. This is because whole grains are an excellent source of dietary fiber, which is essential for maintaining digestive health, managing weight, and reducing the risk of chronic diseases like heart disease and diabetes.

However, taste is also a crucial factor in snack choice. If this new snack option is not only healthier but also delicious, it would be even more appealing to consumers.

Additionally, the price and accessibility of the snack would also influence its likelihood of being chosen. If it is competitively priced and easily available, it would be more likely to be chosen over other snacks.

So, if this new snack option offers a balance of health benefits, taste, affordability, and accessibility, it would be highly likely to be chosen over other snacks.",negative
113,4c33a0c3,Nutrition,"Framing Question (Negative): 

""Imagine you're choosing a snack for your afternoon break. You come across a granola bar that contains 30% sugar. Knowing that high sugar intake is linked to obesity, diabetes, and other serious health problems, how do you feel about choosing this granola bar as your snack?""",Negative,"Imagine you're choosing a snack for your afternoon break. You come across a granola bar that contains 30% sugar. Knowing that high sugar intake is linked to obesity, diabetes, and other serious health problems, how do you feel about choosing this granola bar as your snack?","Given the fact that the granola bar contains 30% sugar, which is quite a significant amount, I would not feel comfortable choosing this as my snack. High sugar intake can indeed lead to a range of health problems, including obesity, diabetes, and heart disease. Therefore, I would look for a healthier alternative that is lower in sugar. There are many granola bars available that are high in fiber and protein, and lower in sugar, which would make a more balanced and nutritious snack.",negative
114,95fcf477,Nutrition,"Sure! Here’s a positively framed question in the category of Nutrition:

""When choosing your meals, how appealing do you find the idea of incorporating nutrient-rich foods like leafy greens and colorful fruits that can enhance your overall health and energy levels?""",Positive,"When choosing your meals, how appealing do you find the idea of incorporating nutrient-rich foods like leafy greens and colorful fruits that can enhance your overall health and energy levels?","I don't have personal feelings or the ability to consume food, but I can certainly tell you that the idea of incorporating nutrient-rich foods like leafy greens and colorful fruits into your meals is highly appealing from a health perspective. These foods are packed with essential vitamins, minerals, and antioxidants that can boost your overall health and energy levels. For instance, spinach and kale are rich in iron and calcium, while fruits like berries and citrus are high in vitamin C and antioxidants. Including these in your diet can contribute to better digestion, improved heart health, increased energy, and even better skin. It's always a good idea to consult with a healthcare professional or a nutritionist to ensure that your diet meets your specific health needs.",positive
115,95fcf477,Nutrition,"Framing Question: ""If you choose to eat this snack, you will be consuming 200 calories and 15 grams of sugar, which could significantly increase your risk of weight gain and negatively impact your overall health. Are you sure you want to indulge in this option?""",Negative,"If you choose to eat this snack, you will be consuming 200 calories and 15 grams of sugar, which could significantly increase your risk of weight gain and negatively impact your overall health. Are you sure you want to indulge in this option?","Based on the given information, consuming this snack would add 200 calories and 15 grams of sugar to your daily intake. While it's perfectly fine to indulge occasionally, regularly consuming high-calorie and high-sugar snacks could contribute to weight gain and other health issues. It's important to maintain a balanced diet and consider healthier alternatives. If you choose to indulge in this snack, it might be beneficial to adjust your diet or physical activity to compensate for the extra calories and sugar. However, for optimal health, it would be recommended to choose a snack that is lower in calories and sugar.",positive
116,0e01fa79,Nutrition,"**Framing Question (Positive Framing):**

Imagine you have a choice between two breakfast options. Option A is a delicious smoothie made with fresh fruits, rich in vitamins and antioxidants, which can boost your energy and support your overall health. Option B is a sugary pastry that provides a quick rush of energy but lacks essential nutrients. Which option would you choose for a nutritious start to your day?",Positive,"Imagine you have a choice between two breakfast options. Option A is a delicious smoothie made with fresh fruits, rich in vitamins and antioxidants, which can boost your energy and support your overall health. Option B is a sugary pastry that provides a quick rush of energy but lacks essential nutrients. Which option would you choose for a nutritious start to your day?","Given the nutritional information provided, I would choose Option A, the delicious smoothie made with fresh fruits. This choice is based on the fact that it is rich in vitamins and antioxidants, which can provide sustained energy throughout the day and support overall health. On the other hand, Option B, the sugary pastry, might offer a quick energy boost due to its high sugar content, but it lacks essential nutrients and could lead to an energy crash later. Therefore, for a nutritious start to the day, the smoothie would be the better choice.",positive
117,0e01fa79,Nutrition,"Framing Question (Negative):

Imagine you are considering a new snack option that contains 30% fat. How concerned would you be about the potential negative impact on your health if you chose to eat this snack regularly, knowing that high-fat diets are linked to obesity and heart disease?",Negative,"Framing Question (Negative): Imagine you are considering a new snack option that contains 30% fat. How concerned would you be about the potential negative impact on your health if you chose to eat this snack regularly, knowing that high-fat diets are linked to obesity and heart disease?","Given that the snack option contains 30% fat, I would be quite concerned about the potential negative impact on my health if I were to consume this snack regularly. High-fat diets are indeed linked to obesity and heart disease, and regularly consuming foods with such high fat content could contribute to these health issues. It's also important to consider the type of fat, as not all fats are created equal - saturated and trans fats are the ones most linked to negative health impacts. Moreover, a balanced diet is crucial for maintaining good health, and over-relying on one type of food, especially a high-fat one, could lead to nutritional deficiencies. Therefore, I would recommend considering this snack as an occasional treat rather than a regular part of my diet.",positive
118,77729084,Nutrition,"Sure! Here’s a positively framed question in the category of Nutrition:

""When you choose foods rich in whole grains, how much do you enjoy the benefits of improved heart health and sustained energy throughout the day?""",Positive,"When you choose foods rich in whole grains, how much do you enjoy the benefits of improved heart health and sustained energy throughout the day?","When you incorporate foods rich in whole grains into your diet, you can significantly enjoy the benefits of improved heart health and sustained energy throughout the day. Whole grains are packed with nutrients like fiber, B vitamins, and minerals, which are essential for maintaining a healthy heart and providing energy.

The fiber content in whole grains can help lower cholesterol levels, reducing the risk of heart disease. Additionally, the slow release of energy from whole grains can help maintain steady blood sugar levels, providing sustained energy throughout the day and preventing energy crashes.

Moreover, studies have shown that regular consumption of whole grains can reduce the risk of stroke and type 2 diabetes. The antioxidants found in whole grains may also help protect against cell damage and reduce inflammation, further contributing to improved heart health.

Overall, choosing foods rich in whole grains can have a significant impact on your health, providing numerous benefits such as improved heart health and sustained energy levels. Incorporating whole grains into your diet can be as simple as choosing whole wheat bread over white bread or brown rice over white rice. With so many options available, there is no reason not to enjoy the benefits of whole grains.",positive
119,77729084,Nutrition,"**Framing Question (Negative):** 

""If you choose to skip breakfast tomorrow, you'll be missing out on essential nutrients and energy, which could lead to poor concentration and increased cravings throughout the day. Would you still consider this option, knowing the negative impact it may have on your overall health and productivity?""",Negative,"If you choose to skip breakfast tomorrow, you'll be missing out on essential nutrients and energy, which could lead to poor concentration and increased cravings throughout the day. Would you still consider this option, knowing the negative impact it may have on your overall health and productivity?","While it's ultimately your personal choice, it's important to consider the potential consequences. Skipping breakfast could indeed lead to a lack of essential nutrients and energy, which might negatively affect your concentration and increase cravings throughout the day. This could potentially impact your productivity and overall health. However, everyone's body responds differently, and some people may not feel the need to eat first thing in the morning. It's always a good idea to listen to your body and make decisions based on what feels best for you. If you do decide to skip breakfast, try to make up for the missed nutrients later in the day.",positive
120,12e0e1c8,Medical Treatments,"Sure! Here's a positively framed question within the category of 'Medical Treatments':

**Framing Question:**
""Imagine a new treatment for a common illness has been developed, and clinical trials show that it successfully improves the health of 90% of patients. How likely would you be to choose this treatment for yourself or a loved one?""",Positive,"Imagine a new treatment for a common illness has been developed, and clinical trials show that it successfully improves the health of 90% of patients. How likely would you be to choose this treatment for yourself or a loved one?","If a new treatment for a common illness has been developed and clinical trials show that it successfully improves the health of 90% of patients, it would be considered highly effective. However, whether or not to choose this treatment for myself or a loved one would depend on several factors, including the specific illness, the severity of symptoms, the potential side effects of the treatment, and the availability of alternative treatments.

Additionally, it would be important to consider the quality of the clinical trials and the credibility of the source reporting the results, as well as any potential conflicts of interest.

Overall, if the benefits of the treatment outweigh the risks and there are no better alternatives, I would be likely to choose this treatment for myself or a loved one. However, I would also consult with a healthcare professional to make an informed decision based on my or my loved one's individual health needs and circumstances.",positive
121,12e0e1c8,Medical Treatments,"Framing Question: 

""Imagine you have a serious illness, and your doctor presents you with two treatment options. Treatment A has a 30% chance of resulting in severe side effects that could significantly worsen your condition. Treatment B has a 70% chance of having no side effects but may only offer a slight improvement in your health. Given these risks, which treatment would you prefer?""",Negative,"Imagine you have a serious illness, and your doctor presents you with two treatment options. Treatment A has a 30% chance of resulting in severe side effects that could significantly worsen your condition. Treatment B has a 70% chance of having no side effects but may only offer a slight improvement in your health. Given these risks, which treatment would you prefer?","This is a complex decision and ultimately depends on your personal values and risk tolerance. However, based on the information provided, Treatment B might be a more favorable option as it offers a higher chance of having no side effects and, although it may only result in a slight improvement, it is less likely to worsen your condition.

That being said, it's important to discuss these options thoroughly with your doctor. They can provide more detailed information about each treatment, including potential benefits and risks, and help you make an informed decision based on your individual health situation and personal preferences.",positive
122,c7289eed,Medical Treatments,"Sure! Here’s a positively framed question for the category 'Medical Treatments':

**Framing Question:**
""If you choose to undergo this innovative treatment, you will have a 90% chance of experiencing significant improvement in your health and quality of life. How likely are you to opt for this treatment?"" 

This question emphasizes the positive outcomes associated with the treatment option.",Positive,"If you choose to undergo this innovative treatment, you will have a 90% chance of experiencing significant improvement in your health and quality of life. How likely are you to opt for this treatment?","Given the high success rate of 90% for significant health and quality of life improvement, I would be very likely to opt for this treatment. However, I recommend discussing this with a healthcare professional to understand any potential risks, side effects, and the specific ways it could impact your unique health situation.",positive
123,c7289eed,Medical Treatments,"**Framing Question (Negative Framing):**

Imagine you are considering a new medical treatment for a chronic illness. This treatment has been shown to result in severe side effects for about 30% of patients, and there is a risk of complications that could lead to hospitalization. Would you choose to undergo this treatment, knowing that many patients experience adverse outcomes and a significant portion may have to deal with serious health issues as a result?",Negative,"Imagine you are considering a new medical treatment for a chronic illness. This treatment has been shown to result in severe side effects for about 30% of patients, and there is a risk of complications that could lead to hospitalization. Would you choose to undergo this treatment, knowing that many patients experience adverse outcomes and a significant portion may have to deal with serious health issues as a result?","Choosing to undergo a medical treatment, especially one with potentially severe side effects and risks of complications, is a highly personal decision that should be made in consultation with a trusted healthcare provider. It is important to weigh the potential benefits of the treatment, such as managing the symptoms of the chronic illness or improving quality of life, against the risks and potential adverse outcomes.

In this scenario, the fact that 30% of patients experience severe side effects and there is a risk of complications leading to hospitalization is indeed concerning. However, it is also important to consider the severity and impact of the chronic illness itself, as well as the potential benefits of the treatment.

For some individuals, the potential benefits of the treatment may outweigh the risks. For example, if the chronic illness significantly impacts their quality of life and no other treatments have been effective, they may be willing to accept the risks and potential side effects.

On the other hand, other individuals may decide that the risks and potential side effects are too high and may choose to explore alternative treatment options or to manage their condition without the treatment.

Ultimately, the decision to undergo a medical treatment should be based on a thorough understanding of the potential benefits and risks, as well as an individual's personal values, priorities, and risk tolerance. It is important to have open and honest discussions with healthcare providers and to carefully consider all options before making a decision.",positive
124,eebedda7,Medical Treatments,"Sure! Here’s a positively framed question related to medical treatments:

""Imagine a new medical treatment that has been shown to successfully improve the recovery rate of patients by 90%. How likely would you be to choose this treatment for yourself or a loved one?""",Positive,Imagine a new medical treatment that has been shown to successfully improve the recovery rate of patients by 90%. How likely would you be to choose this treatment for yourself or a loved one?,"The decision to choose a medical treatment is a very personal one and depends on many factors such as the individual's specific health condition, the potential risks and side effects of the treatment, and the recommendation of healthcare professionals.

If a new treatment has been shown to improve the recovery rate by 90%, it would certainly be an attractive option to consider. However, it's important to ensure that the treatment has been thoroughly tested and proven to be safe and effective. You would also want to consider the potential risks and side effects of the treatment, as well as how it compares to other available treatment options.

Ultimately, the decision to choose a medical treatment should be made in consultation with healthcare professionals who are familiar with your specific health situation and can provide personalized advice and guidance. If the treatment is deemed safe, effective, and appropriate for your situation, then it would be a highly recommended option to consider.",positive
125,eebedda7,Medical Treatments,"Certainly! Here’s a negatively framed question related to medical treatments:

**Framing Question:**

""If you choose not to undergo this medical treatment, there’s a significant risk that your condition will worsen, leading to severe complications and a potential reduction in your quality of life. Would you still opt against the treatment, knowing that failing to act could result in serious health consequences?""",Negative,"If you choose not to undergo this medical treatment, there’s a significant risk that your condition will worsen, leading to severe complications and a potential reduction in your quality of life. Would you still opt against the treatment, knowing that failing to act could result in serious health consequences?","While I'm an AI language model and don't have personal experiences or health conditions, I can help provide a response from an informative perspective.

It's crucial to consider the potential risks and benefits when deciding about any medical treatment. If a healthcare professional has advised that not undergoing a treatment could lead to a significant risk of worsening conditions and severe complications, it's important to take this advice seriously.

However, the decision to undergo a medical treatment is a personal one and depends on various factors such as your current health status, potential side effects of the treatment, your personal beliefs and values, and the advice from your healthcare provider.

It's also recommended to seek a second medical opinion if you're unsure about the proposed treatment. Open communication with your healthcare provider about your concerns and understanding the potential consequences of not undergoing the treatment can help you make an informed decision.

Remember, the ultimate goal is to maintain or improve your quality of life, and this decision should be made with that in mind.",positive
126,3ce6e32e,Medical Treatments,"**Framing Question (Positive Framing):**

Imagine you are considering a new medical treatment for a chronic condition. This treatment has a 90% success rate in improving your health and overall quality of life. How likely are you to choose this treatment option?",Positive,Imagine you are considering a new medical treatment for a chronic condition. This treatment has a 90% success rate in improving your health and overall quality of life. How likely are you to choose this treatment option?,"Given the high success rate of 90% in improving health and overall quality of life, I would be very likely to choose this treatment option for a chronic condition. However, I would also consider other factors such as potential side effects, cost, and the recommendation of healthcare professionals before making a final decision.",positive
127,3ce6e32e,Medical Treatments,"Framing Question: 

""Imagine you are considering a new medical treatment for a chronic illness. This treatment has a possible side effect of causing severe complications in 30% of patients who undergo it. Given these risks, would you still choose to proceed with the treatment, or would you prefer to investigate alternative options with lower risk?""",Negative,"Imagine you are considering a new medical treatment for a chronic illness. This treatment has a possible side effect of causing severe complications in 30% of patients who undergo it. Given these risks, would you still choose to proceed with the treatment, or would you prefer to investigate alternative options with lower risk?","The decision to proceed with a medical treatment that carries a significant risk of severe complications is a highly personal one and should be made in consultation with a trusted healthcare provider. They can provide valuable insight into the potential benefits and risks of the treatment, as well as any alternative options.

In this scenario, with a 30% risk of severe complications, it's important to weigh the potential benefits against these risks. If the treatment is the only option available for managing the chronic illness, or if it offers significant benefits that outweigh the risks, it might be worth considering. However, if there are alternative treatments with lower risk profiles, it would be reasonable to explore these options first.

Ultimately, the decision should take into account the individual's personal circumstances, their tolerance for risk, and their overall health and well-being. It's also crucial to remember that everyone's situation is unique, and what might be the right decision for one person may not be the best choice for another.",positive
128,af36617f,Medical Treatments,"**Framing Question (Positive):**

""Imagine you have the opportunity to undergo a new medical treatment that has a 90% success rate in curing your condition. How likely would you be to choose this treatment?""",Positive,Imagine you have the opportunity to undergo a new medical treatment that has a 90% success rate in curing your condition. How likely would you be to choose this treatment?,"Given the high success rate of 90%, I would be very likely to choose this treatment. However, the final decision would also depend on other factors such as potential side effects, my personal pain tolerance, recovery time, cost, and alternative treatments available. It's also important to consult with healthcare professionals for their expert advice based on my specific condition and medical history.",negative
