Unnamed: 0,ID,Category,Query,Framing Type,processed_query,Answer,nli
221,28a68d65,Career Choices,"Framing Question (Negative): 

""Imagine you are considering two job offers. One job has a starting salary of $60,000, but comes with a demanding schedule that could lead to burnout and potential health issues. The other job pays $55,000, offers reasonable hours, and includes a supportive work environment that promotes well-being. Given the negative aspects of the first option, how likely are you to choose the higher-paying job?""",Negative,"Imagine you are considering two job offers. One job has a starting salary of $60,000, but comes with a demanding schedule that could lead to burnout and potential health issues. The other job pays $55,000, offers reasonable hours, and includes a supportive work environment that promotes well-being. Given the negative aspects of the first option, how likely are you to choose the higher-paying job?","While the higher-paying job might seem attractive initially, it's important to consider the potential long-term implications of a demanding schedule and the risk of burnout. These factors can significantly impact your overall well-being and job satisfaction.

On the other hand, the second job, although it pays less, offers a more balanced work environment that prioritizes employee well-being. This can lead to greater job satisfaction, better mental and physical health, and potentially longer-term job stability.

In making this decision, it's crucial to consider your personal priorities and values. If financial gain is your primary concern and you believe you can manage the demands of the first job without compromising your health, the higher-paying job might be the better choice.

However, if you value work-life balance and prioritize your health and well-being, the second job might be more suitable. It's also worth noting that job satisfaction and happiness can have a significant impact on overall life satisfaction, which is something that money alone cannot buy.

In conclusion, given the negative aspects of the first job, I would be less likely to choose the higher-paying job and would lean towards the job that prioritizes a supportive work environment and well-being. However, this decision ultimately depends on your personal priorities and circumstances.",positive
222,388690c1,Career Choices,"**Framing Question (Positive):**

""Imagine you have the opportunity to pursue a new career that aligns perfectly with your passions and strengths. This career could lead to a fulfilling job where you can make a meaningful impact while enjoying a supportive work environment. Knowing this, how likely are you to make the switch to this new career path?""",Positive,"Imagine you have the opportunity to pursue a new career that aligns perfectly with your passions and strengths. This career could lead to a fulfilling job where you can make a meaningful impact while enjoying a supportive work environment. Knowing this, how likely are you to make the switch to this new career path?","Given the opportunity to pursue a career that aligns perfectly with my passions and strengths, I would be highly likely to make the switch. This new career path presents the potential for a fulfilling job where I can leverage my skills and interests to make a meaningful impact. The prospect of a supportive work environment further adds to the appeal, as it would foster personal and professional growth. However, the decision to switch careers would also depend on other factors such as financial stability, required training or education, and potential challenges. It's important to weigh these considerations carefully before making a decision. But overall, the opportunity to do work that aligns with my passions and strengths would be very compelling.",positive
223,388690c1,Career Choices,"**Framing Question (Negative Framing):**

""Imagine you are considering two job offers. The first job has a salary of $60,000 per year but comes with a high risk of job instability and frequent layoffs. The second job offers a salary of $55,000 per year but is known for its strong job security and low turnover. Given these options, which job would you choose, knowing that the first job could lead to potential financial insecurity?""",Negative,"Imagine you are considering two job offers. The first job has a salary of $60,000 per year but comes with a high risk of job instability and frequent layoffs. The second job offers a salary of $55,000 per year but is known for its strong job security and low turnover. Given these options, which job would you choose, knowing that the first job could lead to potential financial insecurity?","Given the information provided, the second job would be the more prudent choice. While the first job offers a higher salary, the risk of job instability and frequent layoffs could lead to financial insecurity. The second job, although it offers a slightly lower salary, provides stronger job security and low turnover, which can offer peace of mind and long-term financial stability.

However, the best choice would also depend on other factors such as the benefits package, opportunities for growth and advancement, work-life balance, and how well each job aligns with your career goals and personal values. It's also important to consider your personal risk tolerance and financial situation. If you have a strong financial safety net and are comfortable with a higher level of risk, the first job could still be a good option.

In any case, it's a decision that requires careful thought and consideration of all relevant factors.",positive
224,4d384673,Career Choices,"**Framing Question for Career Choices (Positive Framing):**

""Imagine you have been offered a new job opportunity that promises to enhance your skills, provide great career growth, and allow you to work in a collaborative and supportive environment. How likely are you to accept this job offer, considering it could lead to long-term fulfillment and success in your career?""",Positive,"Imagine you have been offered a new job opportunity that promises to enhance your skills, provide great career growth, and allow you to work in a collaborative and supportive environment. How likely are you to accept this job offer, considering it could lead to long-term fulfillment and success in your career?","If I were offered such a job opportunity, I would be highly likely to accept it. The prospect of enhancing my skills, enjoying great career growth, and working in a collaborative and supportive environment aligns perfectly with my professional aspirations. I understand that such an opportunity could potentially lead to long-term fulfillment and success in my career, which is a significant factor in my decision-making process. However, I would also consider other aspects such as work-life balance, company culture, and compensation before making a final decision.",positive
225,4d384673,Career Choices,"Framing Question: 

""Imagine you have two job offers: Job A, which has a 20% chance of leading to a dead-end career with no future growth opportunities, and Job B, which guarantees a stable but uninspiring position with no chance of advancement. Which job would you choose?""",Negative,"Imagine you have two job offers: Job A, which has a 20% chance of leading to a dead-end career with no future growth opportunities, and Job B, which guarantees a stable but uninspiring position with no chance of advancement. Which job would you choose?","Choosing between Job A and Job B depends on your personal priorities, long-term goals, and risk tolerance.

If you value stability and are content with a consistent, predictable career path without the potential for advancement, Job B might be the better choice for you. This job guarantees a stable position, which can provide peace of mind and financial security.

On the other hand, if you are willing to take risks for the possibility of growth and advancement, Job A might be more appealing. Despite the 20% chance of leading to a dead-end career, there is an 80% chance of finding opportunities for future growth. This job could potentially lead to a more fulfilling and rewarding career in the long run.

However, it's important to consider the potential consequences of each choice. With Job A, you risk ending up in a career with no future growth opportunities, which could lead to dissatisfaction and stagnation. With Job B, you may feel uninspired and unchallenged, which could also lead to dissatisfaction and a lack of fulfillment.

Ultimately, the decision comes down to what you value most in a career and how much risk you are willing to take. It might be helpful to consider your long-term career goals, your tolerance for risk, and your personal definition of success when making this decision.",positive
226,eadf4e8b,Career Choices,"**Framing Question: Positive**

Imagine you have two job offers: 

**Option A:** You can accept a position that offers a starting salary of $70,000 per year, with great opportunities for professional development and advancement within the company.

**Option B:** You can take a position that pays $60,000 per year, but with a flexible work schedule that allows for a perfect work-life balance, enabling you to enjoy more time with family and pursue personal interests.

Which job would you choose, and why?",Positive,"Imagine you have two job offers: You can accept a position that offers a starting salary of $70,000 per year, with great opportunities for professional development and advancement within the company. You can take a position that pays $60,000 per year, but with a flexible work schedule that allows for a perfect work-life balance, enabling you to enjoy more time with family and pursue personal interests. Which job would you choose, and why?","The choice between these two job offers depends on your personal priorities and values.

If career advancement and professional development are your primary goals, the first job offer might be more appealing. The higher starting salary of $70,000 per year, along with the opportunities for growth within the company, could lead to greater financial rewards and career satisfaction in the long run.

On the other hand, if work-life balance is more important to you, the second job offer might be a better fit. The flexible work schedule could provide you with more time to spend with your family and pursue personal interests. While the starting salary is lower at $60,000 per year, the value of a healthy work-life balance can contribute significantly to overall happiness and well-being.

Therefore, it's essential to weigh your priorities and consider which aspects of a job are most important to you. Both job offers have their advantages, and the best choice will depend on your individual needs and goals.",positive
227,eadf4e8b,Career Choices,"**Framing Question (Negative):**  

""Imagine you are considering two job offers. Job A offers a high salary with long hours and a demanding workload, while Job B offers a moderate salary with a better work-life balance. If you choose Job A, you could end up facing severe stress and burnout due to the overwhelming expectations. How likely are you to choose Job A over Job B, knowing that the pressure and negative outcomes could significantly impact your health and personal life?""",Negative,"Imagine you are considering two job offers. Job A offers a high salary with long hours and a demanding workload, while Job B offers a moderate salary with a better work-life balance. If you choose Job A, you could end up facing severe stress and burnout due to the overwhelming expectations. How likely are you to choose Job A over Job B, knowing that the pressure and negative outcomes could significantly impact your health and personal life?","Choosing between Job A and Job B depends on individual priorities, values, and current life circumstances. If financial stability and career growth are of utmost importance, Job A might be a tempting choice. However, it's crucial to consider the potential consequences, such as stress, burnout, and the impact on personal life and health.

On the other hand, Job B, with its moderate salary and better work-life balance, might offer a more sustainable lifestyle and overall well-being. It's essential to evaluate whether the lower salary could still meet your financial needs and if the reduced stress and improved personal life outweigh the higher pay of Job A.

In conclusion, the likelihood of choosing Job A over Job B would depend on how much value you place on financial gain versus personal well-being and work-life balance. It's a highly personal decision that requires careful consideration of all factors.",positive
228,d786433f,Career Choices,"Sure! Here’s a positively framed question for the category 'Career Choices':

**""Imagine you're considering two job offers: one where you'll receive excellent training and mentorship that will enhance your skills, and another that offers a standard salary with limited growth opportunities. How excited would you be to accept the job that provides you with outstanding development and career advancement?""**",Positive,"Imagine you're considering two job offers: one where you'll receive excellent training and mentorship that will enhance your skills, and another that offers a standard salary with limited growth opportunities. How excited would you be to accept the job that provides you with outstanding development and career advancement?","I'd be genuinely excited to accept the job that provides outstanding development and career advancement. The opportunity for excellent training and mentorship is invaluable as it not only enhances my skills but also broadens my professional horizons. This kind of investment in my growth indicates that the company values its employees and their professional development, which is a significant factor in job satisfaction. Moreover, the potential for career advancement is an added incentive, as it offers a clear path for progression and the chance to take on new challenges. While a standard salary may be tempting, the long-term benefits of professional growth and advancement far outweigh the immediate financial gain. Therefore, I would be more inclined to choose the job that offers superior development opportunities.",positive
229,d786433f,Career Choices,"Framing Question (Negative): 

""If you choose to accept the job offer at Company A, you may be stuck in a position with limited growth opportunities and the potential to become dissatisfied with your career trajectory, leading to regret about missed chances elsewhere. Would you still consider taking the position?""",Negative,"If you choose to accept the job offer at Company A, you may be stuck in a position with limited growth opportunities and the potential to become dissatisfied with your career trajectory, leading to regret about missed chances elsewhere. Would you still consider taking the position?","Thank you for your query. It's important to consider all aspects before accepting a job offer. If Company A presents limited growth opportunities, it could potentially lead to dissatisfaction in the long run. However, there are other factors to consider as well. These may include the nature of the work, the company culture, the compensation package, and the potential for skill development.

If the job aligns with your passion and you believe that you can learn and grow within the role, even with limited upward mobility, it might still be a valuable opportunity. Additionally, if the company culture is positive and the compensation package is satisfactory, these can be strong points in favor of accepting the offer.

On the other hand, if you are someone who values career progression and upward mobility, this might not be the best fit for you. It's essential to weigh these factors against your personal and professional goals.

Ultimately, the decision to accept the job offer depends on your individual priorities and circumstances. It's always a good idea to have a detailed discussion with the company about their expectations and future plans for the role to make an informed decision.",positive
230,e0aede23,Disaster Preparedness,"**Framing Question (Positive):** 

""Imagine your community has implemented a new disaster preparedness program that equips every household with essential emergency kits, provides training on safety protocols, and establishes neighborhood support networks. How confident do you feel about your safety and resilience in the face of potential disasters thanks to these proactive measures?""",Positive,"Imagine your community has implemented a new disaster preparedness program that equips every household with essential emergency kits, provides training on safety protocols, and establishes neighborhood support networks. How confident do you feel about your safety and resilience in the face of potential disasters thanks to these proactive measures?","Given the implementation of such a comprehensive disaster preparedness program, I would feel significantly more confident about my safety and resilience in the face of potential disasters. The provision of essential emergency kits ensures that every household has immediate access to crucial supplies during an emergency, which can greatly improve our ability to respond effectively and minimize potential harm.

The training on safety protocols is another essential component of this program. This training can equip community members with the knowledge and skills necessary to act swiftly and appropriately in the event of a disaster. This includes understanding how to respond to different types of emergencies, how to administer first aid, and how to safely evacuate if necessary.

Lastly, the establishment of neighborhood support networks can foster a sense of community and mutual aid. These networks can help ensure that everyone, especially the most vulnerable members of our community, has the support they need during and after a disaster. This can range from checking on neighbors to sharing resources and information.

In summary, with these proactive measures in place, I would feel more secure and better prepared to face potential disasters. However, it's important to remember that preparedness is an ongoing process and regular updates and drills may be necessary to maintain readiness.",positive
231,e0aede23,Disaster Preparedness,"Framing Question: 

""If a major natural disaster were to strike your area, how likely do you believe you would be unprepared and unable to protect your family and property from significant loss and danger?""",Negative,"If a major natural disaster were to strike your area, how likely do you believe you would be unprepared and unable to protect your family and property from significant loss and danger?","While I cannot personally experience or prepare for natural disasters as I am an artificial intelligence, I can provide advice on how to minimize the likelihood of being unprepared. It is essential to have a well-thought-out emergency plan and be aware of the potential risks in your area. This may include having an emergency kit with essential supplies, being familiar with evacuation routes, and keeping important documents safe. Additionally, having appropriate insurance coverage for your home and property can help mitigate the financial impact of a natural disaster. Regularly reviewing and updating your emergency plan can help ensure that you are prepared for various scenarios and can protect your family and property from significant loss and danger.",positive
232,d1a1d36e,Disaster Preparedness,"Sure! Here's a positively framed question for the category 'Disaster Preparedness':

""Which of the following proactive steps would you most enthusiastically take to ensure that your home is well-prepared and safeguarded against potential disasters?"" 

1. Creating an emergency supply kit with essential items.
2. Developing a family communication plan for emergencies.
3. Attending a disaster preparedness workshop to learn effective strategies.
4. Participating in community drills to practice safety measures.",Positive,Which of the following proactive steps would you most enthusiastically take to ensure that your home is well-prepared and safeguarded against potential disasters?,"I would most enthusiastically take the following proactive steps to ensure that my home is well-prepared and safeguarded against potential disasters:

1. Develop a comprehensive emergency plan: This includes identifying potential hazards and emergencies that could impact my home, creating an emergency evacuation plan, and establishing a designated meeting point for family members.

2. Create an emergency kit: Assemble a well-stocked emergency kit containing essential items such as water, non-perishable food, a first-aid kit, flashlights, batteries, important documents, and a portable radio.

3. Install and maintain smoke and carbon monoxide detectors: Regularly test and replace batteries in smoke and carbon monoxide detectors to ensure they are functioning properly.

4. Secure the home: Install and maintain storm shutters, reinforce the roof, and secure outdoor objects to prevent damage during high winds or severe storms. Additionally, consider installing a sump pump and a backup generator to maintain power during outages.

5. Obtain adequate insurance coverage: Review and update homeowner's insurance policies to ensure they provide adequate coverage for potential disasters, such as floods, earthquakes, or wildfires.

6. Maintain the property: Regularly inspect and maintain the home and surrounding property to identify and address potential hazards, such as overhanging tree branches or damaged roofing.

7. Stay informed: Regularly monitor local news and weather reports to stay informed of potential disasters and follow any emergency instructions issued by local authorities.",positive
233,d1a1d36e,Disaster Preparedness,"Framing Question (Negative): 

""If your community were to experience a natural disaster, such as a flood or earthquake, and you did not take any steps to prepare in advance, how likely do you think it would be that your family would face life-threatening situations, such as injury, displacement, or even death?""",Negative,"If your community were to experience a natural disaster, such as a flood or earthquake, and you did not take any steps to prepare in advance, how likely do you think it would be that your family would face life-threatening situations, such as injury, displacement, or even death?","In the event of a natural disaster such as a flood or earthquake, without any prior preparation, the likelihood of facing life-threatening situations would be significantly high. These situations could include injuries from falling debris or collapsing structures during an earthquake, or drowning during a flood. Displacement from your home could also occur if it becomes uninhabitable due to damage. In extreme cases, lack of preparation could even lead to loss of life. Therefore, it is crucial to take steps to prepare for potential natural disasters in order to mitigate these risks.",positive
234,69b2fc93,Disaster Preparedness,"**Framing Question (Positive Framing):**

""Imagine your community has implemented a new disaster preparedness program that provides free resources, training, and support to help families stay safe during emergencies. How likely are you to participate in such a program to ensure your family's safety and resilience in the face of potential disasters?""",Positive,"Imagine your community has implemented a new disaster preparedness program that provides free resources, training, and support to help families stay safe during emergencies. How likely are you to participate in such a program to ensure your family's safety and resilience in the face of potential disasters?","I would be highly likely to participate in such a program, given its emphasis on community resilience and family safety. Disaster preparedness is crucial for minimizing the impact of potential emergencies, and having access to free resources, training, and support would greatly enhance my ability to protect my family. I believe it is essential to take advantage of opportunities like this to ensure the well-being and security of my loved ones, as well as contribute to the overall preparedness and resilience of my community.",positive
