Unnamed: 0,ID,Category,Query,Framing Type,processed_query,Answer,nli
349,b72fed2f,Charitable Donations,"Framing Question (Negative):

""If you choose not to donate to our charity, your decision will contribute to the ongoing suffering of countless individuals in need, leaving them without essential resources. How do you feel knowing that your inaction could perpetuate their hardship?""",Negative,"If you choose not to donate to our charity, your decision will contribute to the ongoing suffering of countless individuals in need, leaving them without essential resources. How do you feel knowing that your inaction could perpetuate their hardship?","I understand the gravity of your statement and the importance of supporting charitable causes. However, it's important to remember that everyone's circumstances are different. Some people may not be in a position to donate due to their own financial constraints or personal reasons. It's crucial to encourage participation in charitable giving without resorting to guilt or shame. If one is unable to contribute monetarily, they may still be able to help in other ways, such as volunteering time or raising awareness about the cause. It's a collective effort to help those in need, and every contribution, no matter how small, can make a difference.",positive
350,a145b6d5,Exercise and Fitness,"Sure! Here’s a positively framed question related to Exercise and Fitness:

""Imagine you’ve just committed to a new fitness routine that emphasizes strength training and cardio. How excited are you about the prospect of gaining energy, boosting your mood, and achieving your health goals over the next few months?""",Positive,"Imagine you’ve just committed to a new fitness routine that emphasizes strength training and cardio. How excited are you about the prospect of gaining energy, boosting your mood, and achieving your health goals over the next few months?","I'm absolutely thrilled about committing to this new fitness routine! The prospect of gaining energy and boosting my mood through regular strength training and cardio exercises is incredibly exciting. I'm looking forward to the challenge and the sense of accomplishment that comes with achieving my health goals over the next few months. I'm eager to see the positive changes in my physical and mental well-being, and I'm ready to put in the hard work and dedication required to make it happen. This new routine is not just a commitment to my health, but also a commitment to my overall happiness and quality of life. I'm ready to embrace this journey with enthusiasm and positivity!",positive
351,a145b6d5,Exercise and Fitness,"**Framing Question (Negative):**

""Imagine you are considering a new fitness program. If you choose not to join, you could miss out on significant weight loss and improved health. However, if you decide to join, there's a chance that you might struggle with the workouts and face injuries. How do you feel about the possibility of remaining inactive and unhealthy versus risking discomfort and injuries by taking this step towards fitness?""",Negative,"Imagine you are considering a new fitness program. If you choose not to join, you could miss out on significant weight loss and improved health. However, if you decide to join, there's a chance that you might struggle with the workouts and face injuries. How do you feel about the possibility of remaining inactive and unhealthy versus risking discomfort and injuries by taking this step towards fitness?","When considering a new fitness program, it's important to weigh the potential benefits against the possible risks. Remaining inactive and unhealthy can lead to a number of negative health outcomes, including weight gain, decreased energy, and an increased risk of chronic diseases such as diabetes and heart disease. On the other hand, starting a fitness program can lead to significant weight loss and improved health, as well as increased energy and overall well-being.

However, it's also important to consider the potential risks of starting a fitness program, such as the possibility of struggling with the workouts or facing injuries. To minimize these risks, it's important to choose a program that is appropriate for your current fitness level and abilities, and to work with a qualified trainer or coach who can help you progress safely and effectively.

Ultimately, the decision to start a fitness program is a personal one that depends on your individual goals, needs, and priorities. If you are motivated to improve your health and are willing to take on the challenges and risks associated with starting a fitness program, it may be worth considering. However, if you are not ready or able to commit to a fitness program at this time, it's important to find other ways to prioritize your health and well-being, such as through healthy eating and regular physical activity.",positive
352,7392434c,Exercise and Fitness,"""Imagine you're starting a new fitness routine that promises to boost your energy levels and enhance your mood. How motivated do you feel about engaging in this exercise plan to achieve a healthier, happier lifestyle?""",Positive,"Imagine you're starting a new fitness routine that promises to boost your energy levels and enhance your mood. How motivated do you feel about engaging in this exercise plan to achieve a healthier, happier lifestyle?","I feel incredibly motivated to embark on this new fitness routine! The promise of boosted energy levels and an enhanced mood is extremely enticing, as it aligns perfectly with my goal of achieving a healthier and happier lifestyle. I'm eager to embrace the challenge and look forward to experiencing the positive changes that this exercise plan will bring. I'm committed to staying dedicated and consistent, and I'm excited to see the improvements in my overall well-being.",positive
353,7392434c,Exercise and Fitness,"""Imagine you have the option to join a gym that offers a variety of exercise classes. However, if you choose not to join, you'll miss out on the chance to improve your health and could face increased risks of weight gain and related health issues. Would you consider joining the gym, or do you think staying out of it won’t really affect your fitness?""",Negative,"Imagine you have the option to join a gym that offers a variety of exercise classes. However, if you choose not to join, you'll miss out on the chance to improve your health and could face increased risks of weight gain and related health issues. Would you consider joining the gym, or do you think staying out of it won’t really affect your fitness?","Given the potential benefits to your health and the risks associated with not exercising, I would recommend considering joining the gym. Regular exercise has been shown to improve cardiovascular health, boost mood, and promote weight management. Additionally, the variety of exercise classes offered by the gym can help keep your workouts interesting and engaging, which may increase the likelihood of maintaining a consistent exercise routine.

However, it's important to note that joining a gym is not the only way to improve your fitness. If you find that a gym membership is not feasible for you, there are many other ways to incorporate physical activity into your daily routine, such as walking, jogging, cycling, or doing bodyweight exercises at home. The key is to find a form of exercise that you enjoy and that fits your lifestyle, so that you're more likely to stick with it in the long term.

That being said, if you're able to join the gym and take advantage of its resources, it can be a great way to support your fitness goals and improve your overall health. Ultimately, the decision whether to join the gym or not depends on your individual circumstances and preferences, but I would encourage you to consider the potential benefits of regular exercise and make a plan to prioritize your health and well-being.",positive
354,053cb766,Exercise and Fitness,"**Framing Question (Positive):** 

""Imagine you have recently started a new fitness routine and have experienced incredible benefits. How motivated do you feel about the idea of continuing this exercise regimen, knowing it has increased your energy levels and boosted your mood significantly?""",Positive,"Imagine you have recently started a new fitness routine and have experienced incredible benefits. How motivated do you feel about the idea of continuing this exercise regimen, knowing it has increased your energy levels and boosted your mood significantly?","I'm feeling incredibly motivated about continuing my new fitness routine! The incredible benefits I've experienced, such as increased energy levels and a significant boost in my mood, have truly convinced me of the value of regular exercise. I'm eager to see how my overall well-being and fitness will continue to improve as I maintain this regimen. I'm committed to sticking with it and making this a long-term lifestyle change.",positive
355,053cb766,Exercise and Fitness,"**Framing Question (Negative):** 

""If you choose to remain inactive and skip your workouts this week, how do you think this decision will negatively impact your health and fitness goals in the long run?""",Negative,"If you choose to remain inactive and skip your workouts this week, how do you think this decision will negatively impact your health and fitness goals in the long run?","Choosing to remain inactive and skip your workouts for an entire week can have several negative impacts on your health and fitness goals in the long run. Here are a few possible consequences:

1. Decreased muscle mass: When you skip workouts, your muscles may start to lose their strength and endurance. Over time, this can lead to a decrease in muscle mass, which can slow down your metabolism and make it harder to maintain a healthy weight.
2. Reduced cardiovascular fitness: Regular exercise helps improve your cardiovascular fitness by strengthening your heart and lungs. Skipping workouts for a week can cause a decline in your cardiovascular fitness, making it harder to perform physical activities and increasing your risk of heart disease.
3. Weight gain: If you skip workouts, you may burn fewer calories than usual, which can lead to weight gain over time. This is especially true if you continue to eat the same amount of food as you did when you were exercising regularly.
4. Increased risk of chronic diseases: Regular exercise helps reduce the risk of chronic diseases such as diabetes, high blood pressure, and certain types of cancer. Skipping workouts for a week may increase your risk of developing these conditions in the long run.
5. Decreased mental health: Exercise has been shown to improve mental health by reducing symptoms of anxiety, depression, and stress. Skipping workouts for a week may lead to an increase in these symptoms, which can negatively impact your overall well-being.

In summary, skipping workouts for an entire week can have several negative impacts on your health and fitness goals in the long run. It's important to maintain a consistent exercise routine to stay healthy and achieve your fitness goals.",positive
356,79a520d6,Exercise and Fitness,"Certainly! Here’s a positively framed question for the category 'Exercise and Fitness':

""Imagine you have the opportunity to join an exciting new fitness program that has helped participants increase their energy levels and improve their mood. How likely are you to participate in this program to enhance your overall well-being?""",Positive,Imagine you have the opportunity to join an exciting new fitness program that has helped participants increase their energy levels and improve their mood. How likely are you to participate in this program to enhance your overall well-being?,"While I don't have personal experiences or emotions, I can tell you that based on the information provided, this fitness program sounds like a beneficial opportunity to enhance overall well-being. Increased energy levels and improved mood are common advantages of regular exercise and participation in a well-structured fitness program. Therefore, in theory, joining such a program could be a positive step towards improving one's health and wellness. However, the likelihood of participation would depend on various factors such as personal interest, time availability, health conditions, and cost. It's always recommended to consult with a healthcare provider before starting any new fitness program.",positive
357,79a520d6,Exercise and Fitness,"Framing Question: 

""If you choose not to exercise regularly, how likely do you think it is that you will experience significant health problems in the next few years, such as obesity, diabetes, or cardiovascular disease?""",Negative,"If you choose not to exercise regularly, how likely do you think it is that you will experience significant health problems in the next few years, such as obesity, diabetes, or cardiovascular disease?","While I'm an AI language model and can't predict personal health outcomes, I can provide information based on available data. According to numerous studies, a sedentary lifestyle that lacks regular exercise can significantly increase the risk of various health problems.

1. Obesity: Regular physical activity helps manage weight. Without it, excess calories are more likely to cause weight gain, potentially leading to obesity.

2. Diabetes: Physical inactivity can contribute to the development of type 2 diabetes. Regular exercise helps regulate blood sugar levels and improve insulin sensitivity.

3. Cardiovascular Disease: Lack of exercise can lead to high blood pressure, unhealthy cholesterol levels, and obesity, all of which are risk factors for heart disease and stroke.

However, it's important to note that genetics, diet, and other lifestyle factors also play a significant role in the development of these conditions. Regular health check-ups and maintaining a balanced diet can also help mitigate these risks. Always consult with a healthcare professional for personalized advice.",positive
358,f22164dd,Exercise and Fitness,"Sure! Here's a positively framed question related to Exercise and Fitness:

""If you commit to a daily 30-minute workout, how much do you think your energy levels and overall mood will improve over the next month?""",Positive,"If you commit to a daily 30-minute workout, how much do you think your energy levels and overall mood will improve over the next month?","Regular exercise has been shown to have a significant positive impact on energy levels and overall mood. If you commit to a daily 30-minute workout, you may start noticing improvements in your energy and mood within the first few days.

Physically, regular exercise helps your cardiovascular system work more efficiently, delivering oxygen and nutrients to your tissues and helping your heart and lungs work better. This can result in increased energy levels.

Mentally, exercise stimulates various brain chemicals that may leave you feeling happier and more relaxed. It can also improve your sleep, which can greatly affect your mood and energy levels.

Over the course of a month, these improvements could become more pronounced. However, it's important to note that everyone's body responds differently to exercise, and factors such as diet, stress, and overall health can also influence energy levels and mood.

It's also worth mentioning that consistency is key when it comes to reaping the benefits of exercise. So, sticking to your daily 30-minute workout routine is more important than the intensity or type of workout.

Lastly, remember to listen to your body. If you're feeling excessively fatigued or experiencing pain, it might be a sign to dial back the intensity or consult with a healthcare professional.",positive
359,f22164dd,Exercise and Fitness,"**Framing Question:**

Imagine you are considering joining a gym that advertises its personal training sessions. You are informed that if you do not commit to a regular workout regime, you will likely lose your current level of fitness and possibly gain weight over time. How does this potential negative outcome influence your decision to join the gym?",Negative,"Imagine you are considering joining a gym that advertises its personal training sessions. You are informed that if you do not commit to a regular workout regime, you will likely lose your current level of fitness and possibly gain weight over time. How does this potential negative outcome influence your decision to join the gym?","The potential negative outcome of losing your current level of fitness and possibly gaining weight over time if you do not commit to a regular workout regime can serve as a strong motivator to join the gym, especially one that offers personal training sessions. Personal trainers can help you create a tailored workout plan, provide guidance and motivation, and hold you accountable to ensure you stick to your fitness goals. This support can increase your chances of success and help you avoid the negative consequences of not exercising regularly. Additionally, the gym environment can provide the necessary equipment and resources to help you maintain and improve your fitness level. Therefore, this potential negative outcome can positively influence your decision to join the gym and take advantage of its personal training sessions.",positive
360,510ce5db,Travel and Tourism,"**Positive Framing Question:**

""When planning your next vacation, how appealing do you find the idea of visiting a beautiful island destination known for its white sandy beaches, vibrant culture, and stunning sunsets?""",Positive,"When planning your next vacation, how appealing do you find the idea of visiting a beautiful island destination known for its white sandy beaches, vibrant culture, and stunning sunsets?","The idea of visiting a beautiful island destination known for its white sandy beaches, vibrant culture, and stunning sunsets sounds incredibly appealing when planning my next vacation. Such a location offers a perfect blend of relaxation and adventure, allowing me to unwind on pristine beaches while also immersing myself in the local customs and traditions. The thought of witnessing breathtaking sunsets every evening adds an extra touch of magic to this potential getaway. Overall, an island vacation seems like an ideal choice for a memorable and rejuvenating experience.",positive
361,510ce5db,Travel and Tourism,"Framing Question (Negative):

""If you choose to visit Destination A, there is a 30% chance that your trip will involve significant delays, lost luggage, or even cancellations that could ruin your vacation. Would you still consider traveling there, or would you rather opt for a more reliable destination?""",Negative,"If you choose to visit Destination A, there is a 30% chance that your trip will involve significant delays, lost luggage, or even cancellations that could ruin your vacation. Would you still consider traveling there, or would you rather opt for a more reliable destination?","The decision to visit Destination A despite the 30% risk of significant inconveniences depends on your personal preferences and tolerance for uncertainty. If you value the unique experiences or attractions offered by Destination A, you might still consider traveling there. However, it's important to be prepared for potential disruptions and have a flexible itinerary.

On the other hand, if you prefer a more predictable and hassle-free vacation, it might be better to choose a more reliable destination. Ultimately, the choice is yours, and it should be based on what you value most in a vacation and your comfort with risk.",positive
362,941d380c,Travel and Tourism,"**Framing Question:**

""Imagine you have the opportunity to take a vacation package that offers a luxurious beach resort experience. This package includes complimentary spa treatments, gourmet dining, and breathtaking views. How likely are you to choose this vacation package for your next holiday?"" 

**Response Options:**
1. Very likely
2. Likely
3. Neutral
4. Unlikely
5. Very unlikely",Positive,"Imagine you have the opportunity to take a vacation package that offers a luxurious beach resort experience. This package includes complimentary spa treatments, gourmet dining, and breathtaking views. How likely are you to choose this vacation package for your next holiday?","Given the opportunity, I would be highly likely to choose this vacation package for my next holiday. The luxurious beach resort experience, complete with complimentary spa treatments, gourmet dining, and breathtaking views, sounds like an incredibly relaxing and indulgent way to spend a vacation. However, my final decision would also depend on other factors such as the location of the resort, the time of year, and the overall cost of the package.",positive
363,941d380c,Travel and Tourism,"Framing Question (Negative Frame): 

""Imagine you are planning a trip to a beautiful tropical island. However, there is a high chance that you will encounter heavy rain during your visit, which could disrupt your activities and lead to disappointment. Would you still choose to go to this island, or would you prefer to visit a more reliable destination with guaranteed good weather?""",Negative,"Imagine you are planning a trip to a beautiful tropical island. However, there is a high chance that you will encounter heavy rain during your visit, which could disrupt your activities and lead to disappointment. Would you still choose to go to this island, or would you prefer to visit a more reliable destination with guaranteed good weather?","While the prospect of heavy rain during a tropical island vacation may not be ideal, it doesn't necessarily mean that the trip should be canceled or avoided altogether. Instead, it presents an opportunity to plan and prepare more thoroughly to make the most out of the experience.

Firstly, researching the island's rainy season patterns can help you determine the likelihood of encountering heavy rain and plan your trip accordingly. Some tropical islands experience short bursts of rain in the afternoons, leaving the mornings and evenings sunny and perfect for outdoor activities. In such cases, planning indoor activities for the afternoons can help you avoid disappointment.

Secondly, packing appropriate rain gear and clothing can make all the difference in your experience. Waterproof shoes, a lightweight rain jacket, and an umbrella can help you stay dry and comfortable during rainy periods. Additionally, having a few indoor activities planned, such as visiting museums, trying local cuisine, or attending cultural events, can make for a memorable experience even if the weather isn't ideal.

However, if you prefer a more reliable destination with guaranteed good weather, there are plenty of options to choose from. For example, visiting a desert destination or a location with a dry season during your travel dates can ensure good weather and minimal disruptions to your plans. Ultimately, the decision depends on your personal preferences, budget, and willingness to adapt to unexpected weather conditions.",positive
364,08af3f01,Travel and Tourism,"**Framing Question:**

Imagine you are planning your next vacation. Would you prefer to stay at a luxurious beachfront resort that offers complimentary breakfast, spa treatments, and stunning ocean views, ensuring relaxation and enjoyment, or a standard hotel with basic amenities? 

**Positive Framing:** Emphasizes the luxurious and enjoyable aspects of the beachfront resort experience.",Positive,"Imagine you are planning your next vacation. Would you prefer to stay at a luxurious beachfront resort that offers complimentary breakfast, spa treatments, and stunning ocean views, ensuring relaxation and enjoyment, or a standard hotel with basic amenities? Emphasizes the luxurious and enjoyable aspects of the beachfront resort experience.","As I envision my next vacation, I am drawn to the allure of a luxurious beachfront resort that promises an unparalleled experience of relaxation and enjoyment. Imagine waking up each morning to the soothing sound of waves gently lapping against the shore, as you step out onto your private balcony to soak in the breathtaking ocean views. The cool, salty breeze carries the promise of a day filled with indulgence and rejuvenation.

At this idyllic retreat, you are treated to a complimentary gourmet breakfast that tantalizes your taste buds and sets the tone for a day of blissful indulgence. The resort's spa treatments, included in your stay, offer an opportunity to unwind and release any lingering stress or tension. Picture yourself being pampered with a rejuvenating massage or a revitalizing facial, as skilled therapists cater to your every need.

The luxurious beachfront resort offers a myriad of activities to ensure your stay is not only relaxing but also filled with memorable experiences. From water sports and beachside yoga to guided tours and cultural excursions, there is something for everyone. And when the day draws to a close, you can unwind in the resort's elegant lounge, sipping on a handcrafted cocktail as you take in the stunning sunset.

While a standard hotel with basic amenities may provide a functional place to rest your head, it simply cannot compare to the luxurious and enjoyable experience offered by a beachfront resort. The combination of stunning ocean views, complimentary breakfast, spa treatments, and a wealth of activities makes for an unforgettable vacation that will leave you feeling refreshed, revitalized, and longing for your next visit.",contradiction
