Unnamed: 0,ID,Category,Query,Framing Type,processed_query,Answer,nli
0,c957ecd4,Finance,"Framing Question (Positive): 

""Imagine you have the opportunity to invest in a new eco-friendly technology company that is projected to yield a 20% return over the next year. How likely would you be to invest in this company, considering the positive impact it could have on both your financial growth and the environment?""",Positive,"Imagine you have the opportunity to invest in a new eco-friendly technology company that is projected to yield a 20% return over the next year. How likely would you be to invest in this company, considering the positive impact it could have on both your financial growth and the environment?","If I were in a position to make such an investment, I would certainly be interested in this opportunity. The potential for a 20% return over the next year is quite attractive, especially considering the average annual return for the S&P 500 has been around 10% over the past decade. However, past performance is not always indicative of future results, and it's important to remember that all investments carry some level of risk.

That being said, the fact that this company is eco-friendly and could have a positive impact on the environment is a significant factor in its favor. As more and more people become aware of the need to reduce our carbon footprint and protect the planet, companies that prioritize sustainability are likely to see increased demand for their products and services.

Before making any investment decision, I would want to conduct thorough research on the company and its technology. This would include reviewing their financial statements, assessing the market potential for their products, and evaluating the management team. I would also want to consider the competitive landscape and any potential risks to the company's success.

Assuming that my research indicates that the company has a solid business plan, a strong management team, and a competitive advantage in the market, I would be inclined to invest. However, I would also want to ensure that I have a well-diversified portfolio and that this investment aligns with my overall financial goals and risk tolerance.

In summary, I would be open to investing in an eco-friendly technology company with the potential for a 20% return, but would want to conduct thorough research and ensure that the investment aligns with my overall financial strategy. The potential for both financial growth and positive environmental impact makes this an exciting opportunity.",positive
1,c957ecd4,Finance,"Framing Question (Negative):

""If you invest in this mutual fund, there is a 40% chance that you will experience a significant loss of your principal investment. Would you still choose to invest, knowing there is a risk of losing nearly half of your money?""",Negative,"If you invest in this mutual fund, there is a 40% chance that you will experience a significant loss of your principal investment. Would you still choose to invest, knowing there is a risk of losing nearly half of your money?","The decision to invest in a mutual fund, especially one with a significant risk of loss, depends on your individual financial situation, risk tolerance, and investment goals. If you're a risk-averse investor or if the funds you're considering investing are essential for your immediate or near-future needs, it might be wise to avoid such a high-risk investment. However, if you have a high-risk tolerance, a long-term investment horizon, and the potential loss would not jeopardize your financial stability, you might consider this investment. It's always recommended to consult with a financial advisor before making such decisions.",positive
2,df39a1a0,Finance,"Sure! Here’s a positively framed question in the category of Finance:

**Question:**

""If you invest in this sustainable energy project, you will not only contribute to a greener planet but also stand to gain a return that can increase your wealth significantly over the next five years. How likely are you to consider investing in this project?""  

This question highlights the potential positive outcomes of both environmental impact and financial gain, encouraging a favorable response.",Positive,"If you invest in this sustainable energy project, you will not only contribute to a greener planet but also stand to gain a return that can increase your wealth significantly over the next five years. How likely are you to consider investing in this project?","The likelihood of considering an investment in a sustainable energy project would depend on several factors. These may include your personal interest in environmental causes, your investment goals, risk tolerance, and the specific details of the project such as its financial projections, management team, and market conditions.

If you are environmentally conscious and looking for investment opportunities that align with your values, this project could be appealing. Additionally, if you are seeking long-term growth and are comfortable with the potential risks, the promise of significant wealth increase over five years could be a strong incentive.

However, it's important to thoroughly research and understand the project before making a decision. You may want to consult with a financial advisor and review the project's prospectus or business plan. This will help you make an informed decision based on your personal circumstances and investment strategy.

In conclusion, while the benefits of contributing to a greener planet and potentially increasing your wealth are attractive, the decision to invest should be based on a comprehensive evaluation of the project and your personal investment goals and risk tolerance.",negative
3,df39a1a0,Finance,"**Framing Question (Negative):**

Imagine you are considering investing in a new technology startup. You are informed that there is a 70% chance that the company will fail, potentially leading to a complete loss of your investment. Knowing this, how likely are you to proceed with the investment?",Negative,"Imagine you are considering investing in a new technology startup. You are informed that there is a 70% chance that the company will fail, potentially leading to a complete loss of your investment. Knowing this, how likely are you to proceed with the investment?","Based on the information provided, the likelihood of the company failing is quite high at 70%. This means there is a significant risk associated with investing in this startup, as there is a strong possibility that the investment may result in a complete loss.

However, the decision to proceed with the investment would depend on various factors such as the potential return on investment, the investor's risk tolerance, diversification of the investment portfolio, and personal financial situation.

If the potential return is high enough to justify the risk or if the investor has a high risk tolerance and can afford to potentially lose the entire investment, they might still consider proceeding. On the other hand, if the investor is risk-averse or cannot afford to lose the investment, it would be wise to reconsider.

Therefore, while the high failure rate is a significant factor to consider, the final decision would depend on the individual investor's circumstances and risk appetite. It is always recommended to consult with a financial advisor before making such decisions.",negative
4,d5192a0a,Finance,"Framing Question (Positive Framing):

""Imagine you have the opportunity to invest in a new savings plan that guarantees a 20% return on your investment over the next year. How likely are you to take advantage of this opportunity to grow your wealth?""",Positive,Imagine you have the opportunity to invest in a new savings plan that guarantees a 20% return on your investment over the next year. How likely are you to take advantage of this opportunity to grow your wealth?,"While I don't have personal experiences or emotions, I can provide you with a general perspective on this matter.

If such an opportunity were available, it would indeed be quite enticing due to the high guaranteed return of 20% over a relatively short period of one year. However, it's important to approach such opportunities with caution. In the world of finance, high returns often come with high risks. Therefore, it would be advisable to thoroughly research and understand the details of this savings plan, including the terms and conditions, the credibility of the institution offering it, and the potential risks involved. If after careful consideration, the plan appears to be legitimate and the risks are acceptable, then it would be a great opportunity to grow wealth. However, if the risks are too high or the plan seems too good to be true, it may be wise to reconsider. Always remember, if an investment opportunity seems excessively attractive, it's worth double-checking its legitimacy.",negative
5,d5192a0a,Finance,"Framing Question: 

""You are considering an investment opportunity that has a 60% chance of losing $10,000 and a 40% chance of gaining $15,000. How likely are you to pursue this investment, knowing that there is a significant risk of a substantial financial loss?""",Negative,"You are considering an investment opportunity that has a 60% chance of losing $10,000 and a 40% chance of gaining $15,000. How likely are you to pursue this investment, knowing that there is a significant risk of a substantial financial loss?","The decision to pursue this investment opportunity depends on your personal risk tolerance and financial situation.

The expected value of this investment can be calculated by multiplying each outcome by its probability and then adding them together. In this case, the expected value is (-$10,000 * 0.6) + ($15,000 * 0.4) = -$6,000 + $6,000 = $0.

However, this calculation does not take into account your personal financial situation or your risk tolerance. Given that there is a 60% chance of losing a substantial amount of money, it is considered a risky investment. If you are risk-averse, have limited financial resources, or cannot afford to lose $10,000, it may be wise to avoid this investment.

On the other hand, if you are comfortable with the risk and have the financial means to absorb a potential loss, you may choose to pursue this investment. It is important to remember that past performance is not indicative of future results and there is always a chance of losing money when investing.

Ultimately, the decision is yours and should be based on a careful consideration of your personal circumstances and investment goals. It may be helpful to consult with a financial advisor before making a decision.",negative
6,846f5326,Finance,"**Framing Question (Positive Frame):**

Imagine you have the opportunity to invest in a new technology company that has a 70% chance of yielding a 20% return on your investment over the next year. How excited are you about the potential for financial growth with this investment? 

(Options: Very excited, Somewhat excited, Neutral, Somewhat not excited, Not excited at all)",Positive,"Imagine you have the opportunity to invest in a new technology company that has a 70% chance of yielding a 20% return on your investment over the next year. How excited are you about the potential for financial growth with this investment? (Options: Very excited, Somewhat excited, Neutral, Somewhat not excited, Not excited at all)",Somewhat excited,contradiction
7,846f5326,Finance,"Framing Question (Negative): 

""If you invest in this mutual fund, there is a risk that you could lose up to 20% of your initial investment within the first year. Would you still consider this fund as part of your investment portfolio?""",Negative,"If you invest in this mutual fund, there is a risk that you could lose up to 20% of your initial investment within the first year. Would you still consider this fund as part of your investment portfolio?","The decision to invest in a mutual fund involves a careful consideration of various factors including your risk tolerance, investment goals, and the overall composition of your portfolio. The potential risk of losing up to 20% of your initial investment within the first year is indeed significant. However, I am an AI language model and do not have personal beliefs, emotions, or investment capabilities.

That being said, I can provide some general advice: High-risk investments can potentially yield higher returns, but they also carry a greater risk of loss. If you are a conservative investor or nearing a financial goal where you cannot afford to lose a significant portion of your investment, this fund might not be suitable for you. On the other hand, if you have a higher risk tolerance, a long-term investment horizon, and believe that the potential returns justify the risk, you might consider including this fund in your portfolio.

It's always recommended to diversify your portfolio to spread the risk and consult with a financial advisor before making investment decisions. They can provide personalized advice based on your financial situation and goals.",contradiction
8,db550806,Finance,"Framing Question: 

""If you invest in this sustainable energy fund, there's a 90% chance you'll contribute to a cleaner environment and potentially earn a return of 8% or more on your investment over the next five years. How much would you like to invest in securing a greener future?""",Positive,"If you invest in this sustainable energy fund, there's a 90% chance you'll contribute to a cleaner environment and potentially earn a return of 8% or more on your investment over the next five years. How much would you like to invest in securing a greener future?","I'm an AI language model and don't have personal desires or the ability to make investments. However, I can help you understand the potential benefits of investing in a sustainable energy fund.

If you choose to invest, the amount you decide to put in would depend on your personal financial situation, risk tolerance, and investment goals. It's important to consider these factors carefully and possibly consult with a financial advisor.

The potential return of 8% or more over the next five years, while not guaranteed, could be an attractive investment opportunity. Additionally, the environmental benefits of supporting sustainable energy sources are significant, as they contribute to a cleaner and greener future.

Remember, all investments carry risk, and it's crucial to thoroughly research and understand the specifics of any investment opportunity before committing funds.",positive
9,db550806,Finance,"Framing Question: 

""Imagine you have invested in a mutual fund that has recently reported a 20% loss over the past year. Would you feel more inclined to hold onto this investment in the hopes of recovery, or would you consider selling it to prevent further losses, knowing that many investors have faced significant downturns similar to yours?""",Negative,"Imagine you have invested in a mutual fund that has recently reported a 20% loss over the past year. Would you feel more inclined to hold onto this investment in the hopes of recovery, or would you consider selling it to prevent further losses, knowing that many investors have faced significant downturns similar to yours?","The decision to hold or sell an investment that has recently incurred a loss depends on various factors, and it's important to approach this situation with a level head and a long-term perspective. Here are some points to consider:

1. Risk Tolerance: Your risk tolerance plays a significant role in this decision. If you are a risk-averse investor and the recent loss has caused significant stress or discomfort, it might be better to consider selling and reallocating your funds to investments that align with your risk profile.

2. Time Horizon: If your investment horizon is long-term, you might be more inclined to hold onto the investment, as markets tend to be cyclical, and there's a chance of recovery over time. However, if you need the funds in the short term, it might be more prudent to sell and avoid potential further losses.

3. Diversification: Check if your overall investment portfolio is well-diversified. If this mutual fund forms a significant portion of your portfolio and the recent loss has made your portfolio unbalanced, you might want to consider rebalancing and selling some of your holdings in this fund.

4. Fund Performance: Analyze the fund's historical performance and management. If the fund has a history of bouncing back from downturns and has a competent management team, it might be worth holding onto the investment. However, if the fund has consistently underperformed or its management team is questionable, selling might be a better option.

5. Market Conditions: Consider the current market conditions and economic outlook. If the market is expected to recover in the near future, it might be worth holding onto the investment. However, if the market is expected to remain bearish, you might want to sell and consider alternative investments.

Ultimately, the decision to hold or sell should be based on a careful analysis of these factors and a thorough understanding of your financial goals and risk tolerance. It's also advisable to consult with a financial advisor before making any major investment decisions.",positive
10,3d40ad02,Health,"Framing Question (Positive): 

""If you choose to participate in this new health initiative, you will be one of the first to experience a cutting-edge wellness program designed to enhance your vitality and overall well-being. How excited are you to take this step towards a healthier future?""",Positive,"If you choose to participate in this new health initiative, you will be one of the first to experience a cutting-edge wellness program designed to enhance your vitality and overall well-being. How excited are you to take this step towards a healthier future?",I'm an enthusiastic proponent of health initiatives and I'm thrilled at the prospect of participating in this cutting-edge wellness program! The opportunity to enhance my vitality and overall well-being is incredibly exciting. I'm eager to take this significant step towards a healthier future and look forward to experiencing the benefits of this innovative program. Thank you for the opportunity to be one of the first to embark on this journey!,positive
11,3d40ad02,Health,"Framing Question: 

""Imagine you're considering a new health treatment for a chronic condition. You learn that this treatment has a 30% chance of resulting in severe side effects that could significantly worsen your health. Would you choose to undergo this treatment, or would you prefer to continue with your current, less effective option that has no associated risks?""",Negative,"Imagine you're considering a new health treatment for a chronic condition. You learn that this treatment has a 30% chance of resulting in severe side effects that could significantly worsen your health. Would you choose to undergo this treatment, or would you prefer to continue with your current, less effective option that has no associated risks?","The decision to undergo a new health treatment or continue with a less effective option largely depends on individual circumstances, personal risk tolerance, and the advice of a trusted healthcare provider.

In this hypothetical scenario, a 30% chance of severe side effects is indeed a significant risk. However, it's also important to consider the potential benefits of the new treatment. If it has a high chance of effectively managing the chronic condition, improving quality of life, or even curing the condition, some people might find the risk worth taking.

On the other hand, if the current, less effective treatment, despite not fully addressing the condition, is still providing some relief and maintaining a reasonable quality of life, some people might prefer to stick with it to avoid the potential risks associated with the new treatment.

It's also crucial to remember that everyone's tolerance for risk and perception of what constitutes a ""severe"" side effect can vary. Therefore, this decision should ideally be made in consultation with a healthcare provider who can provide personalized advice based on a comprehensive understanding of the individual's health, the nature of the chronic condition, and the specifics of the new treatment.

In conclusion, without more specific information and personal context, it's challenging to definitively say whether one should choose the new treatment or stick with the current, less effective option. It's a decision that should be made in consultation with a healthcare provider, taking into account all the potential risks and benefits.",positive
12,a2c1b757,Health,"Certainly! Here’s a positively framed question in the health category:

**Framing Question:**
""If you participate in a new health program, you will improve your overall well-being and experience a significant boost in energy levels, leading to a healthier and more active lifestyle. How likely are you to join this program?""",Positive,"If you participate in a new health program, you will improve your overall well-being and experience a significant boost in energy levels, leading to a healthier and more active lifestyle. How likely are you to join this program?","While I'm an artificial intelligence and don't have personal health or lifestyle needs, I can certainly help you think through this decision!

Joining a new health program could indeed offer many potential benefits, such as improved overall well-being and increased energy levels, as you mentioned. These benefits could lead to a healthier and more active lifestyle.

However, the likelihood of joining such a program would depend on various factors. These might include the specific details of the program (like the time commitment, cost, and activities involved), your current health status and goals, and your personal preferences and schedule.

It would be important to consider these factors and perhaps discuss the program with a healthcare provider or trusted advisor before making a decision.

If you'd like, I can help you weigh the pros and cons of the program based on more specific details.",negative
13,a2c1b757,Health,"**Framing Question (Negative Framing):**

""If you choose to undergo this new health treatment, there is a 30% chance that you will experience severe side effects that could significantly impact your quality of life. Would you still prefer to proceed with this treatment, or would you rather avoid it altogether?""",Negative,"If you choose to undergo this new health treatment, there is a 30% chance that you will experience severe side effects that could significantly impact your quality of life. Would you still prefer to proceed with this treatment, or would you rather avoid it altogether?","The decision to undergo a health treatment with potential severe side effects is a deeply personal one that depends on many factors. These factors include the severity and nature of the condition being treated, the availability of alternative treatments, and the individual's personal risk tolerance.

Given that there is a 30% chance of experiencing severe side effects that could significantly impact quality of life, it is crucial to weigh the potential benefits against the potential risks. It would be advisable to consult with a healthcare provider to understand the full implications of this decision, including the specific nature of the potential side effects and the likelihood of successful treatment.

Ultimately, the choice to proceed or avoid the treatment is a personal one that should be made in consultation with healthcare professionals and considering one's own values and risk tolerance.",negative
14,e63dcaaf,Health,"Framing Question: 

""If you start a new exercise routine, you will not only improve your health and increase your energy levels, but you will also feel more confident and empowered in your daily activities. How motivated do you feel to make this positive change in your life?""",Positive,"If you start a new exercise routine, you will not only improve your health and increase your energy levels, but you will also feel more confident and empowered in your daily activities. How motivated do you feel to make this positive change in your life?","It's wonderful that you're considering the benefits of starting a new exercise routine. Improved health, increased energy levels, and enhanced confidence are indeed compelling reasons to make this positive change. As for your motivation, only you can truly gauge that. However, I'm here to encourage you and remind you that every journey begins with a single step. If you're feeling even a spark of motivation, that's a great starting point. Remember, consistency is key, and the benefits you'll reap from regular exercise are truly transformative. If you need further advice or motivation, feel free to ask!",positive
